{
  "review_type": "plan",
  "target": "harden-multi-vendor-review-recovery",
  "reviewer_vendor": "codex",
  "findings": [
    {
      "id": 1,
      "type": "contract_mismatch",
      "criticality": "high",
      "description": "`contracts/finding.schema.json:41` defines `criticality` as `low|medium|high|blocking`, but the existing review findings schema and consensus synthesizer use `critical`, not `blocking` (`openspec/schemas/review-findings.schema.json:19`, `skills/parallel-infrastructure/scripts/consensus_synthesizer.py:125`). This schema would reject valid existing `critical` findings and accept `blocking`, which the synthesizer ranks as the default lowest severity.",
      "disposition": "fix",
      "resolution": "Change the contract enum to `low|medium|high|critical`, or explicitly update the synthesizer and existing review schemas in this proposal if `blocking` is intended.",
      "file_path": "openspec/changes/harden-multi-vendor-review-recovery/contracts/finding.schema.json",
      "line_range": {
        "start": 41,
        "end": 43
      },
      "vendor": "codex"
    },
    {
      "id": 2,
      "type": "compatibility",
      "criticality": "high",
      "description": "`review-cache-layout.schema.json:7` makes `change_id` required, but the current dispatcher CLI has no change-id or target argument and currently writes the manifest with hardcoded target `cli-dispatch` at `review_dispatcher.py:1371`. The migration tasks do not specify where the new required `change_id` value comes from, so the promised manifest superset is underspecified for the CLI path.",
      "disposition": "fix",
      "resolution": "Add an explicit dispatcher CLI argument/source for `change_id` and update tasks/tests, or make `change_id` optional for generic CLI dispatch manifests while preserving existing `target`.",
      "file_path": "openspec/changes/harden-multi-vendor-review-recovery/contracts/review-cache-layout.schema.json",
      "line_range": {
        "start": 7,
        "end": 17
      },
      "vendor": "codex"
    },
    {
      "id": 3,
      "type": "correctness",
      "criticality": "medium",
      "description": "`tasks.md:48` says synthesis exceptions propagate with \"no try/except wrapper around synthesis,\" but `tasks.md:58` requires emitting an audit event before re-raising the original synthesis exception. The implementation cannot satisfy audit-on-failure without catching the synthesis exception at least long enough to audit and re-raise.",
      "disposition": "fix",
      "resolution": "Revise task 3.2 to prohibit fallback/swallowing, not exception handling, and specify a narrow `try/except` that emits audit and re-raises the original exception.",
      "file_path": "openspec/changes/harden-multi-vendor-review-recovery/tasks.md",
      "line_range": {
        "start": 48,
        "end": 58
      },
      "vendor": "codex"
    },
    {
      "id": 4,
      "type": "testability",
      "criticality": "medium",
      "description": "The spec says `ConvergenceResult` fields let callers detect synthesis failure (`spec.md:86`), but also says no `ConvergenceResult` is returned on the typical failure path (`spec.md:90`, `design.md:243`). As written, `synthesis_failed=True` has no observable API path or task that proves a caller can receive it after `converge()` raises.",
      "disposition": "fix",
      "resolution": "Either remove the `synthesis_failed` claim/field, or define a typed exception carrying `checkpoint_dir` and a partial `ConvergenceResult`, with tests for that observable contract.",
      "file_path": "openspec/changes/harden-multi-vendor-review-recovery/specs/skill-workflow/spec.md",
      "line_range": {
        "start": 84,
        "end": 90
      },
      "vendor": "codex"
    },
    {
      "id": 5,
      "type": "spec_gap",
      "criticality": "medium",
      "description": "`contracts/README.md` still describes CLI subprocess fallback and old fallback audit events at lines 3, 11, 12, and 21, despite the revised proposal explicitly dropping automatic recovery. It also says both schemas declare `schema_version: 1` at line 25, but `finding.schema.json` has no `schema_version` field.",
      "disposition": "fix",
      "resolution": "Rewrite the contracts README around durable checkpoints plus manual invocation, remove fallback event language, and either add `schema_version` to the finding-file schema or stop claiming it exists there.",
      "file_path": "openspec/changes/harden-multi-vendor-review-recovery/contracts/README.md",
      "line_range": {
        "start": 3,
        "end": 25
      },
      "vendor": "codex"
    }
  ]
}